,Date,Text
176,2021-01-06 09:05:05,いや、しがみついてます‼︎
177,2021-01-06 09:05:02,"えっ、もう売ったん？
キリンはここは年単位で持つつもりなんよ
良いところで掴んだかも"
178,2021-01-06 09:04:03,"私はいつも買うのが早すぎて、売るのも早すぎる…
頭としつぽはくれてやれ…と言いますが。
私はお腹のお肉ちょっとしか食べてません！"
179,2021-01-06 09:04:02,抜ける時だけ言わんといて~笑
180,2021-01-06 09:03:08,一旦抜けます。ありがとうございました。
181,2021-01-06 09:03:01,"まだはもうなり…
もうはまだなり…
まだなり？"
182,2021-01-06 09:02:06,降りる時、教えてください。
183,2021-01-06 09:01:07,"そー言ってもらえるとうれしい
ありがとう"
184,2021-01-06 09:01:00,キリンさん来たら上がったよ！
185,2021-01-06 09:00:05,あれっ、何かいいことあったん？
186,2021-01-05 15:04:09,最後追い込み凄い
